{
  "schema_version": "1.0.0",
  "matrix_id": "PHASE-002D-R1-SLOT-OUTCOME-MATRIX-001",
  "input_freeze_id": "PHASE-002D-R1-INPUT-FREEZE-001",
  "schedule_hash": "0000000000000000000000000000000000000000000000000000000000000000",
  "source_attempt_count": 28,
  "expected_slot_count": 24,
  "slots": [
    {"slot_id": "S01", "all_attempt_ids": ["A01"], "outcome_resolution": "RESOLVED_ELIGIBLE_SUCCESS", "slot_hash": "0000000000000000000000000000000000000000000000000000000000000000"},
    {"slot_id": "S02", "all_attempt_ids": ["A02"], "outcome_resolution": "RESOLVED_ELIGIBLE_SUCCESS", "slot_hash": "0000000000000000000000000000000000000000000000000000000000000000"},
    {"slot_id": "S03", "all_attempt_ids": ["A03"], "outcome_resolution": "RESOLVED_ELIGIBLE_SUCCESS", "slot_hash": "0000000000000000000000000000000000000000000000000000000000000000"},
    {"slot_id": "S04", "all_attempt_ids": ["A04"], "outcome_resolution": "RESOLVED_ELIGIBLE_SUCCESS", "slot_hash": "0000000000000000000000000000000000000000000000000000000000000000"},
    {"slot_id": "S05", "all_attempt_ids": ["A05"], "outcome_resolution": "RESOLVED_ELIGIBLE_SUCCESS", "slot_hash": "0000000000000000000000000000000000000000000000000000000000000000"},
    {"slot_id": "S06", "all_attempt_ids": ["A06"], "outcome_resolution": "RESOLVED_ELIGIBLE_SUCCESS", "slot_hash": "0000000000000000000000000000000000000000000000000000000000000000"},
    {"slot_id": "S07", "all_attempt_ids": ["A07"], "outcome_resolution": "RESOLVED_ELIGIBLE_SUCCESS", "slot_hash": "0000000000000000000000000000000000000000000000000000000000000000"},
    {"slot_id": "S08", "all_attempt_ids": ["A08"], "outcome_resolution": "RESOLVED_ELIGIBLE_SUCCESS", "slot_hash": "0000000000000000000000000000000000000000000000000000000000000000"},
    {"slot_id": "S09", "all_attempt_ids": ["A09"], "outcome_resolution": "RESOLVED_ELIGIBLE_SUCCESS", "slot_hash": "0000000000000000000000000000000000000000000000000000000000000000"},
    {"slot_id": "S10", "all_attempt_ids": ["A10"], "outcome_resolution": "RESOLVED_TERMINAL_NEGATIVE", "slot_hash": "0000000000000000000000000000000000000000000000000000000000000000"},
    {"slot_id": "S11", "all_attempt_ids": ["A11"], "outcome_resolution": "RESOLVED_TERMINAL_NEGATIVE", "slot_hash": "0000000000000000000000000000000000000000000000000000000000000000"},
    {"slot_id": "S12", "all_attempt_ids": ["A12"], "outcome_resolution": "RESOLVED_TERMINAL_NEGATIVE", "slot_hash": "0000000000000000000000000000000000000000000000000000000000000000"},
    {"slot_id": "S13", "all_attempt_ids": ["A13"], "outcome_resolution": "RESOLVED_TERMINAL_NEGATIVE", "slot_hash": "0000000000000000000000000000000000000000000000000000000000000000"},
    {"slot_id": "S14", "all_attempt_ids": ["A14"], "outcome_resolution": "RESOLVED_TERMINAL_NEGATIVE", "slot_hash": "0000000000000000000000000000000000000000000000000000000000000000"},
    {"slot_id": "S15", "all_attempt_ids": ["A15"], "outcome_resolution": "RESOLVED_TERMINAL_NEGATIVE", "slot_hash": "0000000000000000000000000000000000000000000000000000000000000000"},
    {"slot_id": "S16", "all_attempt_ids": ["A16"], "outcome_resolution": "RESOLVED_TERMINAL_NEGATIVE", "slot_hash": "0000000000000000000000000000000000000000000000000000000000000000"},
    {"slot_id": "S17", "all_attempt_ids": ["A17"], "outcome_resolution": "RESOLVED_TERMINAL_NEGATIVE", "slot_hash": "0000000000000000000000000000000000000000000000000000000000000000"},
    {"slot_id": "S18", "all_attempt_ids": ["A18"], "outcome_resolution": "RESOLVED_TERMINAL_NEGATIVE", "slot_hash": "0000000000000000000000000000000000000000000000000000000000000000"},
    {"slot_id": "S19", "all_attempt_ids": ["A19"], "outcome_resolution": "RESOLVED_TERMINAL_NEGATIVE", "slot_hash": "0000000000000000000000000000000000000000000000000000000000000000"},
    {"slot_id": "S20", "all_attempt_ids": ["A20"], "outcome_resolution": "RESOLVED_TERMINAL_NEGATIVE", "slot_hash": "0000000000000000000000000000000000000000000000000000000000000000"},
    {"slot_id": "S21", "all_attempt_ids": ["A21"], "outcome_resolution": "RESOLVED_TERMINAL_NEGATIVE", "slot_hash": "0000000000000000000000000000000000000000000000000000000000000000"},
    {"slot_id": "S22", "all_attempt_ids": ["A22"], "outcome_resolution": "RESOLVED_TERMINAL_NEGATIVE", "slot_hash": "0000000000000000000000000000000000000000000000000000000000000000"},
    {"slot_id": "S23", "all_attempt_ids": ["A23"], "outcome_resolution": "RESOLVED_TERMINAL_NEGATIVE", "slot_hash": "0000000000000000000000000000000000000000000000000000000000000000"},
    {"slot_id": "S24", "all_attempt_ids": ["A24"], "outcome_resolution": "CENSORED_HARNESS", "slot_hash": "0000000000000000000000000000000000000000000000000000000000000000"}
  ],
  "resolution_counts": {
    "RESOLVED_ELIGIBLE_SUCCESS": 9,
    "RESOLVED_TERMINAL_NEGATIVE": 14,
    "CENSORED_INFRASTRUCTURE": 0,
    "CENSORED_HARNESS": 1,
    "UNRESOLVED_UNKNOWN": 0,
    "STALE": 0
  },
  "all_attempts_accounted": true,
  "earliest_eligible_selection": true,
  "best_of_n_prohibited": true,
  "matrix_hash": "0000000000000000000000000000000000000000000000000000000000000000"
}
